{
  "version": 1,
  "component": "DatePicker",
  "exports": [
    "DatePicker",
    "DatePickerProps",
    "DateTriggerButton",
    "DateTriggerButtonProps",
    "DATE_TRIGGER_CLASSNAME"
  ],
  "category": "composite",
  "source": "src/components/ui/date-picker.tsx",
  "documentation": "docs/internal/design/components/date-picker.md",
  "owner": "design-system",
  "themes": [
    "dark"
  ],
  "variants": [
    "default"
  ],
  "sizes": [
    "default"
  ],
  "states": [
    "empty",
    "selected",
    "open",
    "disabled",
    "read-only"
  ],
  "stories": [
    {
      "file": "src/components/ui/date-picker.stories.tsx",
      "exports": [
        "Default",
        "Disabled",
        "ReadOnly"
      ]
    }
  ],
  "checks": [
    {
      "id": "date-picker-unit",
      "kind": "unit",
      "file": "src/components/ui/date-picker.test.tsx",
      "test": "DatePicker — selection opens the popover, selecting a day calls onChange with that Date and closes",
      "applicable": true
    },
    {
      "id": "date-picker-interaction",
      "kind": "interaction",
      "file": "src/components/ui/date-picker.stories.tsx",
      "test": "Default",
      "story": "Default",
      "applicable": true
    },
    {
      "id": "date-picker-disabled-interaction",
      "kind": "interaction",
      "file": "src/components/ui/date-picker.stories.tsx",
      "test": "Disabled",
      "story": "Disabled",
      "applicable": true
    },
    {
      "id": "date-picker-read-only-interaction",
      "kind": "interaction",
      "file": "src/components/ui/date-picker.stories.tsx",
      "test": "Read Only",
      "story": "ReadOnly",
      "applicable": true
    },
    {
      "id": "date-picker-axe",
      "kind": "axe",
      "file": "tests/design-system/browser.spec.ts",
      "test": "DatePicker [check:date-picker-axe] axe",
      "story": "Default",
      "applicable": true
    },
    {
      "id": "date-picker-keyboard",
      "kind": "keyboard",
      "file": "tests/design-system/browser.spec.ts",
      "test": "DatePicker [check:date-picker-keyboard] keyboard",
      "story": "Default",
      "applicable": true
    },
    {
      "id": "date-picker-browser",
      "kind": "browser",
      "file": "tests/design-system/browser.spec.ts",
      "test": "DatePicker [check:date-picker-browser] browser",
      "story": "Default",
      "requiredTargets": [{ "selector": "[aria-label=\"Due date\"]", "attribute": "type", "value": "button" }],
      "applicable": true
    },
    {
      "id": "date-picker-pointer",
      "kind": "pointer",
      "file": "tests/design-system/browser.spec.ts",
      "test": "DatePicker [check:date-picker-pointer] pointer",
      "story": "Default",
      "applicable": true
    },
    {
      "id": "date-picker-reduced-motion",
      "kind": "reduced-motion",
      "applicable": false,
      "reason": "Popover motion is owned and verified by the Popover primitive."
    },
    {
      "id": "date-picker-forced-colors",
      "kind": "forced-colors",
      "file": "tests/design-system/browser.spec.ts",
      "test": "DatePicker [check:date-picker-forced-colors] forced-colors",
      "story": "Default",
      "applicable": true
    },
    {
      "id": "date-picker-root-size",
      "kind": "root-size",
      "file": "tests/design-system/browser.spec.ts",
      "test": "DatePicker [check:date-picker-root-size] root-size",
      "story": "Default",
      "applicable": true
    },
    {
      "id": "date-picker-zoom",
      "kind": "zoom",
      "file": "tests/design-system/browser.spec.ts",
      "test": "DatePicker [check:date-picker-zoom] zoom",
      "story": "Default",
      "applicable": true
    },
    {
      "id": "date-picker-reflow",
      "kind": "reflow",
      "file": "tests/design-system/browser.spec.ts",
      "test": "DatePicker [check:date-picker-reflow] reflow",
      "story": "Default",
      "applicable": true
    }
  ]
}
